{
  "name": "loom", "version": "0.2.0", "description": "Spec-driven dev loop with five blind-reviewed roles and an orchestrator",
  "author": { "name": "Craig", "email": "craigeous@gmail.com" }, "homepage": "https://github.com/craigeous/loom", "repository": "https://github.com/craigeous/loom", "license": "MIT",
  "keywords": ["spec-driven", "agents", "orchestration", "code-review", "workflow"]
}
