{
  "name": "loom",
  "version": "0.1.0",
  "description": "Spec-driven dev loop with five blind-reviewed roles and an orchestrator",
  "author": { "name": "Craig", "email": "craigeous@gmail.com" },
  "homepage": "https://github.com/Craigeous/loom",
  "repository": "https://github.com/Craigeous/loom",
  "license": "MIT",
  "keywords": ["spec-driven", "agents", "orchestration", "code-review", "workflow"]
}
